{
  "schemaVersion": "cf2.discourseTupleReview.v1",
  "fixtureId": "CF1-F08",
  "freezeId": "cf2-v7-ab-f01-f03-f08-20260724",
  "frozenInventorySha256": "0e7fbba1da3498da96b7812977f6ba18e93ed415ca9dc0dc86dec466a97a42bc",
  "instructions": "Review the observed tuple field by field. Correct the tuple only from the frozen article units. Do not use outside evidence or the sealed evaluation key as assertion text.",
  "items": [
    {
      "candidateId": "C01",
      "observed": {
        "surfaceStatement": "A magnitude 6.2 earthquake shook part of northern Japan.",
        "surfaceUnitIds": [
          "U0001"
        ],
        "reportingVoice": {
          "name": "The Associated Press",
          "kind": "article_voice",
          "unitIds": []
        },
        "attributionLayers": [],
        "substantiveAssertion": "A magnitude 6.2 earthquake shook part of northern Japan.",
        "substantiveGroundingUnitIds": [
          "U0001"
        ],
        "contentSupplier": {
          "name": "The Associated Press",
          "kind": "article_voice",
          "unitIds": [
            "U0001"
          ],
          "origin": "host_article_voice_no_explicit_layer"
        },
        "primaryVerificationTarget": "substantive_content"
      },
      "review": {
        "status": "unreviewed",
        "tupleVerdict": "not_reviewed",
        "fieldVerdicts": {
          "surface": "not_reviewed",
          "layerStructure": "not_reviewed",
          "substantiveAssertion": "not_reviewed",
          "grounding": "not_reviewed",
          "contentSupplier": "not_reviewed",
          "verificationTarget": "not_reviewed"
        },
        "correctedTuple": null,
        "notes": ""
      }
    },
    {
      "candidateId": "C02",
      "observed": {
        "surfaceStatement": "There was no damage or casualties from the earthquake in northern Japan.",
        "surfaceUnitIds": [
          "U0001"
        ],
        "reportingVoice": {
          "name": "The Associated Press",
          "kind": "article_voice",
          "unitIds": []
        },
        "attributionLayers": [],
        "substantiveAssertion": "There was no damage or casualties from the earthquake in northern Japan.",
        "substantiveGroundingUnitIds": [
          "U0001"
        ],
        "contentSupplier": {
          "name": "The Associated Press",
          "kind": "article_voice",
          "unitIds": [
            "U0001"
          ],
          "origin": "host_article_voice_no_explicit_layer"
        },
        "primaryVerificationTarget": "substantive_content"
      },
      "review": {
        "status": "unreviewed",
        "tupleVerdict": "not_reviewed",
        "fieldVerdicts": {
          "surface": "not_reviewed",
          "layerStructure": "not_reviewed",
          "substantiveAssertion": "not_reviewed",
          "grounding": "not_reviewed",
          "contentSupplier": "not_reviewed",
          "verificationTarget": "not_reviewed"
        },
        "correctedTuple": null,
        "notes": ""
      }
    },
    {
      "candidateId": "C03",
      "observed": {
        "surfaceStatement": "No tsunami advisory was issued by the Japan Meteorological Agency.",
        "surfaceUnitIds": [
          "U0002"
        ],
        "reportingVoice": {
          "name": "The Associated Press",
          "kind": "article_voice",
          "unitIds": []
        },
        "attributionLayers": [],
        "substantiveAssertion": "No tsunami advisory was issued by the Japan Meteorological Agency.",
        "substantiveGroundingUnitIds": [
          "U0002"
        ],
        "contentSupplier": {
          "name": "The Associated Press",
          "kind": "article_voice",
          "unitIds": [
            "U0002"
          ],
          "origin": "host_article_voice_no_explicit_layer"
        },
        "primaryVerificationTarget": "substantive_content"
      },
      "review": {
        "status": "unreviewed",
        "tupleVerdict": "not_reviewed",
        "fieldVerdicts": {
          "surface": "not_reviewed",
          "layerStructure": "not_reviewed",
          "substantiveAssertion": "not_reviewed",
          "grounding": "not_reviewed",
          "contentSupplier": "not_reviewed",
          "verificationTarget": "not_reviewed"
        },
        "correctedTuple": null,
        "notes": ""
      }
    },
    {
      "candidateId": "C04",
      "observed": {
        "surfaceStatement": "The earthquake struck 18 kilometers west of the small town of Sarabetsu.",
        "surfaceUnitIds": [
          "U0003"
        ],
        "reportingVoice": {
          "name": "The Associated Press",
          "kind": "article_voice",
          "unitIds": []
        },
        "attributionLayers": [],
        "substantiveAssertion": "The earthquake struck 18 kilometers west of the small town of Sarabetsu.",
        "substantiveGroundingUnitIds": [
          "U0003"
        ],
        "contentSupplier": {
          "name": "The Associated Press",
          "kind": "article_voice",
          "unitIds": [
            "U0003"
          ],
          "origin": "host_article_voice_no_explicit_layer"
        },
        "primaryVerificationTarget": "substantive_content"
      },
      "review": {
        "status": "unreviewed",
        "tupleVerdict": "not_reviewed",
        "fieldVerdicts": {
          "surface": "not_reviewed",
          "layerStructure": "not_reviewed",
          "substantiveAssertion": "not_reviewed",
          "grounding": "not_reviewed",
          "contentSupplier": "not_reviewed",
          "verificationTarget": "not_reviewed"
        },
        "correctedTuple": null,
        "notes": ""
      }
    },
    {
      "candidateId": "C05",
      "observed": {
        "surfaceStatement": "The earthquake occurred at a depth of 81 kilometers.",
        "surfaceUnitIds": [
          "U0003"
        ],
        "reportingVoice": {
          "name": "The Associated Press",
          "kind": "article_voice",
          "unitIds": []
        },
        "attributionLayers": [],
        "substantiveAssertion": "The earthquake occurred at a depth of 81 kilometers.",
        "substantiveGroundingUnitIds": [
          "U0003"
        ],
        "contentSupplier": {
          "name": "The Associated Press",
          "kind": "article_voice",
          "unitIds": [
            "U0003"
          ],
          "origin": "host_article_voice_no_explicit_layer"
        },
        "primaryVerificationTarget": "substantive_content"
      },
      "review": {
        "status": "unreviewed",
        "tupleVerdict": "not_reviewed",
        "fieldVerdicts": {
          "surface": "not_reviewed",
          "layerStructure": "not_reviewed",
          "substantiveAssertion": "not_reviewed",
          "grounding": "not_reviewed",
          "contentSupplier": "not_reviewed",
          "verificationTarget": "not_reviewed"
        },
        "correctedTuple": null,
        "notes": ""
      }
    },
    {
      "candidateId": "C06",
      "observed": {
        "surfaceStatement": "The earthquake occurred 11 miles west of Sarabetsu.",
        "surfaceUnitIds": [
          "U0003"
        ],
        "reportingVoice": {
          "name": "The Associated Press",
          "kind": "article_voice",
          "unitIds": []
        },
        "attributionLayers": [],
        "substantiveAssertion": "The earthquake occurred 11 miles west of Sarabetsu.",
        "substantiveGroundingUnitIds": [
          "U0003"
        ],
        "contentSupplier": {
          "name": "The Associated Press",
          "kind": "article_voice",
          "unitIds": [
            "U0003"
          ],
          "origin": "host_article_voice_no_explicit_layer"
        },
        "primaryVerificationTarget": "substantive_content"
      },
      "review": {
        "status": "unreviewed",
        "tupleVerdict": "not_reviewed",
        "fieldVerdicts": {
          "surface": "not_reviewed",
          "layerStructure": "not_reviewed",
          "substantiveAssertion": "not_reviewed",
          "grounding": "not_reviewed",
          "contentSupplier": "not_reviewed",
          "verificationTarget": "not_reviewed"
        },
        "correctedTuple": null,
        "notes": ""
      }
    },
    {
      "candidateId": "C07",
      "observed": {
        "surfaceStatement": "The U.S. Geological Survey measured the quake’s strength at 6.1 magnitude.",
        "surfaceUnitIds": [
          "U0005"
        ],
        "reportingVoice": {
          "name": "The Associated Press",
          "kind": "article_voice",
          "unitIds": []
        },
        "attributionLayers": [],
        "substantiveAssertion": "The U.S. Geological Survey measured the quake’s strength at 6.1 magnitude.",
        "substantiveGroundingUnitIds": [
          "U0005"
        ],
        "contentSupplier": {
          "name": "The Associated Press",
          "kind": "article_voice",
          "unitIds": [
            "U0005"
          ],
          "origin": "host_article_voice_no_explicit_layer"
        },
        "primaryVerificationTarget": "substantive_content"
      },
      "review": {
        "status": "unreviewed",
        "tupleVerdict": "not_reviewed",
        "fieldVerdicts": {
          "surface": "not_reviewed",
          "layerStructure": "not_reviewed",
          "substantiveAssertion": "not_reviewed",
          "grounding": "not_reviewed",
          "contentSupplier": "not_reviewed",
          "verificationTarget": "not_reviewed"
        },
        "correctedTuple": null,
        "notes": ""
      }
    },
    {
      "candidateId": "C08",
      "observed": {
        "surfaceStatement": "A week ago, a 7.7 magnitude offshore earthquake prompted Japan to issue an advisory.",
        "surfaceUnitIds": [
          "U0006"
        ],
        "reportingVoice": {
          "name": "The Associated Press",
          "kind": "article_voice",
          "unitIds": []
        },
        "attributionLayers": [],